ID,TITLE,TEXT,DATE,USER_ID
1,Уважаемые выпускники бакалавриата и заинтересованные люди!,Мы в скором времени начнем серию постов о нашей магистратуре "Программная инженерия". Правила приема. дни открытых дверей в магистратуру. новые профили курсы и треки. магистерские проекты - об этом и не только читайте в следующих постах с хэштегом #магистратураИТИС! Следите за новостями в группе!,1496168692368,8
2,Наркотест,Уважаемые студенты. напоминаем. что завтра с 9 до 13 часов Вы должны подойти в Здравпункт КФУ. расположенный в спортблоке КСК КФУ УНИКС для прохождения наркологического тестирования.Необходимо взять с собой паспорт и питьевую воду.Тестирование достаточно быстрое. поэтому желательно. чтобы все подходили вовремя по графику.,1496168692368,8
3,Футболки,Ребята! Наши классные партнеры ЦИПР дарят вам не только крутые лекции но подарки! ТАКОГО масштабного розыгрыша в нашей группе не было очень давно! На кону: 5 свитшотов; 5 поло; 5 футболок ЦИПР; 2 футболки Высшей школы #ИТИС #КФУ; Вы можете в это поверить? 17 победителей! От подарков вас отделяет всего 5 шагов! 1) Нужно быть подписанным на сообщество Высшей школы ИТИС КФУ; 2) Сделать репост этой записи себе на стену; 3) Написать комментарий на стене "Я иду на лекции ЦИПР потому что..." продолжите на свое усмотрение! Естественно фраза "чтобы получить призы" - не принимается! Посмотрите программу выступлений выберите понравившиеся и придумайте оригинальную формулировку!4) Зарегистрироваться на лекции ЦИПР http://cipr.ru/prereg/5) Написать в комментариях "Готово" 23 мая мы проверяем соблюдение правил участия каждому присваиваем номер и выбираем 17 победителей! Ребята когда еще будет такой шанс? И лекции послушать крутые и обновку получить? В общем вперед!,1496168692368,8
4,ATTENTION,Уже сегодня через несколько часов состоится матч предпоследнего тура Росгосстрах чемпионата России по футболу в котором встретятся ФК Рубин (Казань) и ПФК ЦСКА (Москва). Все зарегистрировавшиеся на матч студенты (список представлен ниже) должны подойти в 18-30 к главному входу Дворца Водных Видов Спорта где вас встретит наш куратор по спортивной деятельности - Сергина Татьяна Игоревна.Она же будет отмечать Вас. Не забудьте свой паспорт болельщика и билет. На каф. физвосп. обещаны плюшки)Внимание! Движения транспорта будет перекрыто от Ветеринарной академии до Адоратского. Заранее продумайте как вам лучше добраться.По всем вопросам звоните 89274114835,1496168692368,8
5,Курсовые,Студенты 2 и 3 курса! Приближается время сдачи курсовых работ. В деканат Вы сдаете курсовую работу (титульный лист подписан студентом и научным руководителем) отзыв научного руководителя (см. ссылку edu-itis) отчет о проверке работы в системе "Антиплагиат" (о том в какой системе и как проверить свою работу информация появится позже). Деканат,1496168692368,8